{
  "$schema": "https://json-schema.org/draft/2020-12/schema",
  "$id": "https://aicontextpack.local/schemas/contracts/v1/pipeline-checkpoint-v1.schema.json",
  "title": "PipelineCheckpointV1",
  "type": "object",
  "additionalProperties": false,
  "required": [
    "schemaVersion",
    "id",
    "runId",
    "packId",
    "stage",
    "reason",
    "resumeAction",
    "completedArtifactIds",
    "processor",
    "processorVersion",
    "updatedAt"
  ],
  "properties": {
    "schemaVersion": { "const": 1 },
    "id": { "$ref": "#/$defs/uuid" },
    "runId": { "$ref": "#/$defs/uuid" },
    "packId": { "$ref": "#/$defs/uuid" },
    "itemId": { "$ref": "#/$defs/uuid" },
    "stage": { "enum": ["import", "extract", "analyze", "review", "package"] },
    "reason": {
      "enum": [
        "periodic",
        "backgrounded",
        "cancelled",
        "stage-failure",
        "recovery"
      ]
    },
    "resumeAction": {
      "enum": ["continue", "retry-stage", "recover-stage"]
    },
    "completedArtifactIds": {
      "type": "array",
      "uniqueItems": true,
      "items": { "$ref": "#/$defs/uuid" }
    },
    "processor": { "type": "string", "minLength": 1 },
    "processorVersion": { "type": "string", "minLength": 1 },
    "updatedAt": { "type": "string", "format": "date-time" },
    "errorCode": { "$ref": "#/$defs/errorCode" }
  },
  "$defs": {
    "uuid": {
      "type": "string",
      "pattern": "^[0-9a-f]{8}-[0-9a-f]{4}-[1-5][0-9a-f]{3}-[89ab][0-9a-f]{3}-[0-9a-f]{12}$"
    },
    "errorCode": {
      "enum": [
        "DOMAIN_INVALID_TRANSITION",
        "SCHEMA_INVALID",
        "SCHEMA_VERSION_UNSUPPORTED",
        "ARTIFACT_INTEGRITY_FAILED",
        "IMPORT_PROVIDER_PERMISSION_EXPIRED",
        "IMPORT_TYPE_UNSUPPORTED",
        "IMPORT_COPY_FAILED",
        "IMPORT_PARTIAL_FAILURE",
        "PIPELINE_STAGE_FAILED",
        "PROCESSOR_OUTPUT_INVALID",
        "PIPELINE_RECOVERY_REQUIRED",
        "PRIVACY_REVIEW_REQUIRED",
        "PRIVACY_EXPORT_BLOCKED",
        "RESOURCE_LOW_DISK",
        "RESOURCE_MEMORY_PRESSURE",
        "STORAGE_WRITE_FAILED"
      ]
    }
  }
}
